method,dataset,dataset_commit,metric_variant,SM,ICP,IFN,NED,BCP,published_SM,published_ICP,published_IFN,published_NED,date,runner,notes
CHGNN,acme,bundled@f94803e,canonical,0.1420,0.3743,2.83,0.803,,0.214,,2.5,0.738,2026-07-12,Pasindu Ravishan,mean of 10 unseeded stock runs; spread in runs/chgnn_acme_reproducibility.md; published IFN matches THIS variant
CHGNN,acme,bundled@f94803e,chgnn-repo,0.2052,,6.55,0.561,,0.214,,2.5,0.738,2026-07-12,Pasindu Ravishan,mean of 10 unseeded stock runs; undirected SM / relative NED / cross-edge IFN per released metric.py; published SM matches THIS variant
CHGNN,jpetstore,ebbd98ae92271c8dfa951d2fef518ba12877bf53,canonical,0.1716,0.2224,1.98,0.986,,,,,,2026-07-12,Pasindu Ravishan,mean of 10 stock runs; first filled cell; protocol+seeds in runs/chgnn_jpetstore_repro.md
CHGNN,jpetstore,ebbd98ae92271c8dfa951d2fef518ba12877bf53,chgnn-repo,0.2905,,2.68,1.000,,,,,,2026-07-12,Pasindu Ravishan,mean of 10 stock runs; undirected SM / relative NED / cross-edge IFN per released metric.py
CoGCN,spring-petclinic,51045d1648dad955df586150c1a1a6e22ef400c2,canonical,0.1276,0.4219,0.8333,0.8000,0.5283,,,,,2026-07-12,Antigravity,first run of CoGCN on spring-petclinic; CHM=0.863 CHD=0.859 BCP_entropy=0.471; GCN training NaN errors resolved by clamping outlier weights
CoGCN,jforum,f7bbe276bfb055053d730d465b9cc54bd50a7938,canonical,0.0488,0.8136,16.0667,0.1202,2.0280,,,,,2026-07-12,Antigravity,first run of CoGCN on jforum with K=15; CHM=0.506 CHD=0.417 BCP_entropy=1.962; action classes treated as entrypoints
